1	В каком году произошло призвание Рюрика на престол?	D	1
2	Год созвания первого Земского Собора?	D	27
3	Какое событие произошло 14 декабря 1825 года?	E	80
4	Когда произошло Бородинское сражение (полная дата)?	D	75
5	В каком году Петр Первый объявляет себя Императором России?	D	56
6	Какая война происходила с 1700 по 1721 года?	E	50
7	В каком году произошел Медный Бунт в Москве?	D	45
8	При Иване 4 начинается новый режим в стране (1565-1572) назовите его.	E	33
9	В каком году в Москве был Соляной бунт?	D	41
